{
  "schema_version": "1.0",
  "session_id": null,
  "started_at": null,
  "completed_at": null,
  "tester_role": "automated disposable local Windows profile",
  "environment": {
    "windows_version": "Windows 11 10.0.22631",
    "architecture": "x86_64",
    "profile_type": "fresh_local_profile",
    "source_checkout_present": false,
    "preinstalled_tools": ["Docker Desktop"]
  },
  "artifact": {
    "filename": "FlowProof-Windows-x86_64-0.5.0-productization-candidate.2.zip",
    "sha256": "00454dc55b27e8a05b2264733cf09ff0918d8a79df4490fb909386ee71675ac1",
    "git_commit": "da9057ac21be3fa7ac7e88d19bca9abc509abac9",
    "git_tree": "f88908bf75dcd336e2df33a2907c6a53c313725d"
  },
  "metrics": {
    "download_to_running_seconds": null,
    "running_to_first_demo_outcome_seconds": null,
    "mandatory_decision_count": null,
    "terminal_command_count": 0,
    "manual_secret_handoff_count": 0,
    "support_intervention_count": 0,
    "install_failure_count": 0
  },
  "stages": {
    "prerequisite_check": {
      "status": "BLOCKED",
      "evidence": [
        "Fresh-profile runner and elevated orchestrator parsed under Windows PowerShell 5.1",
        "Targeted disposable-profile contract tests passed",
        "Start-Process -Verb RunAs returned: The operation was canceled by the user",
        "Post-attempt audit found zero FPQual users, profiles and Public staging directories"
      ],
      "note": "The elevated orchestrator did not start, so no disposable user or install session was created."
    },
    "install": { "status": "NOT_RUN", "evidence": [], "note": null },
    "first_open": { "status": "NOT_RUN", "evidence": [], "note": null },
    "safe_demo": { "status": "NOT_RUN", "evidence": [], "note": null },
    "restart_reopen": { "status": "NOT_RUN", "evidence": [], "note": null },
    "diagnostics_export": { "status": "NOT_RUN", "evidence": [], "note": null },
    "backup": { "status": "NOT_RUN", "evidence": [], "note": null },
    "uninstall_preserve": { "status": "NOT_RUN", "evidence": [], "note": null },
    "reinstall_retention": { "status": "NOT_RUN", "evidence": [], "note": null }
  },
  "security": {
    "credentials_in_artifact": false,
    "env_file_in_artifact": false,
    "database_in_artifact": false,
    "raw_customer_data_in_artifact": false
  },
  "result": "BLOCKED",
  "blocker": "FRESH_LOCAL_PROFILE_UAC_APPROVAL_REQUIRED: approve the one elevated disposable-profile harness run, or provide a disposable Windows 11 VM; current-host source-free proof is not fresh-profile proof."
}
