{"schema_version":"1.0","session_id":"842582e2-dff2-4ee3-b011-7df43ff7781f","started_at":"2026-08-08T09:37:13.6225402Z","completed_at":"2026-08-08T09:37:19.6660962Z","tester_role":"automated disposable local Windows profile launcher","environment":{"windows_version":"Windows 10.0.22631.0","architecture":"x86_64","profile_type":"fresh_local_profile","source_checkout_present":false,"preinstalled_tools":["Docker Desktop"]},"artifact":{"filename":"FlowProof-Windows-x86_64-0.5.0-productization-candidate.3.zip","sha256":"7d46dc2905912c10619ce9badb02914021f06bc3a96f5cdb04bbb3c4ffcfcfc6","git_commit":"da9057ac21be3fa7ac7e88d19bca9abc509abac9","git_tree":"f88908bf75dcd336e2df33a2907c6a53c313725d"},"metrics":{"download_to_running_seconds":null,"running_to_first_demo_outcome_seconds":null,"mandatory_decision_count":null,"terminal_command_count":0,"manual_secret_handoff_count":0,"support_intervention_count":0,"install_failure_count":0},"stages":{"prerequisite_check":{"status":"PASS","evidence":["elevated_process_exit_code=0","orchestrator_diagnostics_present=true","orchestrator_event=orchestrator_started;stage=initialize;detail=probe_only=True","orchestrator_event=probe_completed;stage=elevated_probe;detail=admin_token=[redacted]","orchestrator_event=cleanup_completed;stage=cleanup;detail=user_created=False;staging_present=False"],"note":"FRESH_LOCAL_PROFILE_PROBE_ONLY_COMPLETED: elevated prerequisites passed; full install was intentionally not started."},"install":{"status":"NOT_RUN","evidence":[],"note":null},"first_open":{"status":"NOT_RUN","evidence":[],"note":null},"safe_demo":{"status":"NOT_RUN","evidence":[],"note":null},"restart_reopen":{"status":"NOT_RUN","evidence":[],"note":null},"diagnostics_export":{"status":"NOT_RUN","evidence":[],"note":null},"backup":{"status":"NOT_RUN","evidence":[],"note":null},"uninstall_preserve":{"status":"NOT_RUN","evidence":[],"note":null},"reinstall_retention":{"status":"NOT_RUN","evidence":[],"note":null}},"security":{"credentials_in_artifact":false,"env_file_in_artifact":false,"database_in_artifact":false,"raw_customer_data_in_artifact":false},"result":"BLOCKED","blocker":"FRESH_LOCAL_PROFILE_PROBE_ONLY_COMPLETED: elevated prerequisites passed; full install was intentionally not started."}
